,position,company_name,rating,location,date_listed,salary
0,Data Analyst,Jobsugoi.com,,Thailand,26 วันที่ผ่านมา,
1,CRM Data Analyst,Central & Matsumoto Kiyoshi Limited,,Thailand,30+ วันที่ผ่านมา,"25,000 - 35,000 บาทต่อเดือน"
2,Business Analyst,"NTT DATA (Thailand) Co., Ltd.",,Thailand,30+ วันที่ผ่านมา,
3,"Data Analyst, Thailand",Yara,,กรุงเทพมหานคร,10 วันที่ผ่านมา,
4,data analyst,บริษัท ลีโอวูด อินเตอร์เทรด จำกัด,,"พระโขนง, กรุงเทพมหานคร",6 วันที่ผ่านมา,"18,000 - 23,000 บาทต่อเดือน"
5,Data Analytic Officer,Siam Cement PCL (SCG),,Thailand,30+ วันที่ผ่านมา,
6,Data Analyst,บริษัท ออลล์ นาวลอจิสติกส์ จากัด,,"สาทร, กรุงเทพมหานคร",30+ วันที่ผ่านมา,
7,Data Analyst,LINE,,"สาทร, กรุงเทพมหานคร",30+ วันที่ผ่านมา,
8,Business Performance and Data Analyst - E-Business,Nestle,4.1,กรุงเทพมหานคร,30+ วันที่ผ่านมา,
9,Humanitarian Data Analyst – COVID 19,Internews,,Thailand,30+ วันที่ผ่านมา,
10,Data Marketing Analyst,บริษัท สินสงวนแอนด์ซันส์ จำกัด,,สมุทรปราการ,6 วันที่ผ่านมา,"15,000 - 25,000 บาทต่อเดือน"
11,Business Data Analyst,BD,,กรุงเทพมหานคร,3 วันที่ผ่านมา,
12,Investment Analyst,บริษัท ไอร่า แคปปิตอล จำกัด (มหาชน),,"ปทุมวัน, กรุงเทพมหานคร",30+ วันที่ผ่านมา,
13,Data Analyst / Data Scientist,Business Online PCL (BOL),,กรุงเทพมหานคร,30+ วันที่ผ่านมา,
14,Data Analyst,Hill+Knowlton Strategies,,กรุงเทพมหานคร,30+ วันที่ผ่านมา,
15,data analyst,บริษัท โรงพยาบาลสัตว์ทองหล่อ จำกัด,,"พระโขนง, กรุงเทพมหานคร",30+ วันที่ผ่านมา,"19,000 - 30,000 บาทต่อเดือน"
16,Infrastructure & Data Center Support Analyst,"JPMorgan Chase Bank, N.A.",,กรุงเทพมหานคร,3 วันที่ผ่านมา,
17,Analyst - Investment Banking,Prime Street Group,,กรุงเทพมหานคร,28 วันที่ผ่านมา,
18,"CIB - Equity Research - Research Analyst (Thai, Banks) - Ass...","JPMorgan Chase Bank, N.A.",,กรุงเทพมหานคร,3 วันที่ผ่านมา,
19,Data Visualization Analyst,Dentsu Aegis Network,,กรุงเทพมหานคร,30+ วันที่ผ่านมา,
20,"2020 APAC Graduate Programme - Global Markets, Sales Analyst",BNP Paribas,,กรุงเทพมหานคร,30+ วันที่ผ่านมา,
21,Production Analyst,FANATICS (THAILAND) LIMITED,,"ปทุมวัน, กรุงเทพมหานคร",5 วันที่ผ่านมา,
22,logistics analyst executive ประจำสาขาบางนา ตราด กม.19,บริษัท ดีเอชแอล ซัพพลายเชน (ประเทศไทย) จำกัด,,"บางพลี, สมุทรปราการ",30+ วันที่ผ่านมา,
23,"Product, Associate (Business Analyst)",Pomelo Fashion,,กรุงเทพมหานคร,7 วันที่ผ่านมา,
24,logistics analyst,บริษัท ดีเอชแอล ซัพพลายเชน (ประเทศไทย) จำกัด,,"วังน้อย, พระนครศรีอยุธยา",4 วันที่ผ่านมา,
25,Operation & Data Analyst,บริษัท ซิลลิค ฟาร์มา จำกัด / Zuellig Pharma Ltd.,,"คลองเตย, กรุงเทพมหานคร",30+ วันที่ผ่านมา,
26,IT Application Analyst,Celestica,3.9,"แหลมฉบัง, ชลบุรี",วันนี้,
27,data analyst,วิสดอม มันนี่ จำกัด,,"ห้วยขวาง, กรุงเทพมหานคร",10 วันที่ผ่านมา,"20,000 - 40,000 บาทต่อเดือน"
28,"Production Operation Analyst, Associates",Pomelo Fashion,,Thailand,30+ วันที่ผ่านมา,
29,Digital Solutions Analyst,earlycareers-dentsuaegisnetwork,,กรุงเทพมหานคร,วันนี้,
30,Digital Solutions Analyst,Dentsu Aegis Network,,กรุงเทพมหานคร,วันนี้,
31,Production Analyst,Fanatics Inc.,,Thailand,11 วันที่ผ่านมา,
32,Data Visualization Analyst,earlycareers-dentsuaegisnetwork,,กรุงเทพมหานคร,30+ วันที่ผ่านมา,
33,"Senior Credit Risk Analyst, Thailand",Grab Taxi,3.8,กรุงเทพมหานคร,เพิ่งประกาศ,
34,Product Developer,Fanatics Inc.,,Thailand,11 วันที่ผ่านมา,
35,"Product, Associate",Pomelo Fashion,,Thailand,30+ วันที่ผ่านมา,
36,Investment Analyst,PromptBis,,กรุงเทพมหานคร,30+ วันที่ผ่านมา,
37,Financial Analyst,Jet Asia,,กรุงเทพมหานคร,30+ วันที่ผ่านมา,
38,Marketing Analyst,"A.P.Honda Co.,Ltd",,สมุทรปราการ,30+ วันที่ผ่านมา,
39,Data Engineer (Analyst to Manager),Accenture,4.0,กรุงเทพมหานคร,30+ วันที่ผ่านมา,
40,data analyst,"Elabram Systems Co., Ltd .",,"พญาไท, กรุงเทพมหานคร",30+ วันที่ผ่านมา,
41,Communications and Outreach Analyst,UNOPS,,กรุงเทพมหานคร,30+ วันที่ผ่านมา,
42,DATA ANALYST,,,กรุงเทพมหานคร,30+ วันที่ผ่านมา,
43,เจ้าหน้าที่จัดทำ และวิเคราะห์ข้อมูล Strategic data Control &...,"Pasona HR Consulting Recruitment (Thailand) Co.,Lt...",,กรุงเทพมหานคร,30+ วันที่ผ่านมา,
44,data analyst,"VC Fabric Co.,Ltd",,"สวนหลวง, กรุงเทพมหานคร",30+ วันที่ผ่านมา,
45,Strategic Finance Associate,Pomelo Fashion,,กรุงเทพมหานคร,7 วันที่ผ่านมา,
46,Junior Workflow Analyst (Input Operations),Nielsen,3.8,กรุงเทพมหานคร,23 วันที่ผ่านมา,
47,Voice of Customer,Lazada,3.8,Thailand,14 วันที่ผ่านมา,
48,Data Analyst,บริษัท ออมนี่เรส จำกัด,,กรุงเทพมหานคร,3 วันที่ผ่านมา,
49,data analyst,"CDS Solution Corp.,Ltd.",,กรุงเทพมหานคร,30+ วันที่ผ่านมา,
50,Digital Marketing Analyst (Training provided),"Marketyze Co., Ltd.",,กรุงเทพมหานคร,วันนี้,
51,Financial Analyst,Aviagen,,กรุงเทพมหานคร,30+ วันที่ผ่านมา,
52,Business Investment Analyst,บริษัท ธนาคารกรุงเทพ จำกัด (มหาชน),,"สาทร, กรุงเทพมหานคร",30+ วันที่ผ่านมา,
53,Assistant Data Analyst,บริษัท โปรไลแอนซ์ จำกัด,,ลำปาง,21 วันที่ผ่านมา,
54,Staff Analyst - Compensation and Benefits,Seagate Technology,3.8,Thailand,30+ วันที่ผ่านมา,
55,Budget & Planning - Report Analyst Professional 1,CRC,,Thailand,30+ วันที่ผ่านมา,
56,supply chain data analyst,บริษัท นันยางการทออุตสาหกรรม จำกัด,,"หนองแขม, กรุงเทพมหานคร",30+ วันที่ผ่านมา,
57,Strategic Data Analyst,บริษัท ฮิตาชิเซลส์ (ประเทศไทย) จำกัด,,กรุงเทพมหานคร,16 วันที่ผ่านมา,
58,Fashion,Lazada,3.8,Thailand,14 วันที่ผ่านมา,
59,Systems analyst,IMCO Packaging,,"บางพลี, สมุทรปราการ",30+ วันที่ผ่านมา,
60,รับสมัครด่วน*** data analyst ภาษาอังกฤษดี เงิน27k สัญญา1ปี ท...,"P.R. Recruitment and Business Management Co.,Ltd",,"ห้วยขวาง, กรุงเทพมหานคร",30+ วันที่ผ่านมา,"27,000 - 40,000 บาทต่อเดือน"
61,"Assistant Manager - Manager, Digital Data Scientist",Telenor,,กรุงเทพมหานคร,6 วันที่ผ่านมา,
62,System Analyst,บริษัท ยูทิลิตี้ บิสิเนส อัลลายแอนซ์ จำกัด (UBA),,"จตุจักร, กรุงเทพมหานคร",30+ วันที่ผ่านมา,
63,System Analyst,บริษัทจัดหางาน ฮิวแมน เทค จำกัด,,"จตุจักร, กรุงเทพมหานคร",30+ วันที่ผ่านมา,
64,Database Analyst & Data Administrator,บริษัท มโนยนต์ชัย จำกัด,,กรุงเทพมหานคร,30+ วันที่ผ่านมา,
65,Investment Analyst,บริษัท เมตะ คอร์ปอเรชั่น จำกัด (มหาชน),,กรุงเทพมหานคร,3 วันที่ผ่านมา,
66,International Banking Credit Analyst,บริษัท ธนาคารกรุงเทพ จำกัด (มหาชน),,"สาทร, กรุงเทพมหานคร",30+ วันที่ผ่านมา,
67,System Analyst,ธนาคารเกียรตินาคิน,4.3,Thailand,30+ วันที่ผ่านมา,
68,Business Intelligence Analyst,Whatsnew ( Orami ),,Thailand,30+ วันที่ผ่านมา,
69,Business Analyst/Researcher,บริษัท ไอพี คอมเมิร์ซ จำกัด,,นนทบุรี,17 วันที่ผ่านมา,
70,Technical Analyst,ธนาคารไทยพาณิชย์,4.5,กรุงเทพมหานคร,30+ วันที่ผ่านมา,
71,system analyst,"Smart Finder Co., Ltd.",,นนทบุรี,30+ วันที่ผ่านมา,
72,data analyst (supervisor),บริษัท เงินติดล้อ จำกัด,4.4,"พญาไท, กรุงเทพมหานคร",30+ วันที่ผ่านมา,
73,Logistics Analyst,"Artemis (South East Asia) Recruitment Co.,Ltd.",,กรุงเทพมหานคร,30+ วันที่ผ่านมา,
74,Business Analyst,"MFEC Co.,Ltd",,กรุงเทพมหานคร,30+ วันที่ผ่านมา,
75,Data Analyst,Robert Walters,,กรุงเทพมหานคร,18 วันที่ผ่านมา,
76,Data Analyst (นักวิเคราะห์ข้อมูล),,,กรุงเทพมหานคร,30+ วันที่ผ่านมา,"35,000 - 55,000 บาทต่อเดือน"
77,ด่วน!!รับสมัครเจ้าหน้าที่data analyst เงินเดือน25-35k ทำงานท...,"P.R. Recruitment and Business Management Co.,Ltd",,"ห้วยขวาง, กรุงเทพมหานคร",30+ วันที่ผ่านมา,"25,000 - 35,000 บาทต่อเดือน"
78,Business Analyst,"Bangkok Industrial Gas Co.,Ltd",,กรุงเทพมหานคร,30+ วันที่ผ่านมา,
79,Decision Support Analyst,Cargill,3.8,กรุงเทพมหานคร,30+ วันที่ผ่านมา,
80,Business Analyst,"IT Innovation Co.,Ltd",,"ราชเทวี, กรุงเทพมหานคร",30+ วันที่ผ่านมา,
81,BUSINESS INTELLIGENCE ANALYST,Orami Thailand,,Thailand,30+ วันที่ผ่านมา,
82,CCBO - Corporate Investment Advisory,ธนาคารทหารไทย จำกัด (มหาชน),4.4,"จตุจักร, กรุงเทพมหานคร",30+ วันที่ผ่านมา,
83,Data Analyst,Ninja Van,,Thailand,30+ วันที่ผ่านมา,
84,data analyst / management information system,"Saraff Infotech Co.,Ltd",,"ยานนาวา, กรุงเทพมหานคร",30+ วันที่ผ่านมา,
85,junior system analyst (contract),"CDS Solution Corp.,Ltd.",,"บางรัก, กรุงเทพมหานคร",30+ วันที่ผ่านมา,
86,System Analyst,บริษัท กลุ่มแอดวานซ์ รีเสิร์ช จำกัด,,"คลองสาน, กรุงเทพมหานคร",วันนี้,
87,Data analyst (เจ้าหน้าที่วิเคราะห์ข้อมูลรถยนต์),AEON THANA SINSAP (THAILAND) PUBLIC COMPANY LIMITE...,,กรุงเทพมหานคร,30+ วันที่ผ่านมา,"25,000 - 40,000 บาทต่อเดือน"
88,Systems Analyst,บริษัท แผ่นดินทอง พร็อพเพอร์ตี้ ดีเวลลอปเม้นท์ จำก...,,"บางรัก, กรุงเทพมหานคร",10 วันที่ผ่านมา,
89,PRICING ANALYST,Orami Thailand,,Thailand,30+ วันที่ผ่านมา,
90,system analyst - นิคมแหลมฉบัง,บริษัท โปรเฟสชั่นแนล เซอร์วิส โพรไวเดอร์ จำกัด,,ชลบุรี,6 วันที่ผ่านมา,
91,Senior Analyst / Assistant Manager,บริษัท ทริส คอร์ปอเรชั่น จำกัด,,"บางรัก, กรุงเทพมหานคร",6 วันที่ผ่านมา,
92,"Sales ops Analyst(pricing, B&T) - Thailand",Advanced Sterilization Products,,Thailand,30+ วันที่ผ่านมา,
93,business analyst (ba),บริษัท บิลค์ วัน กรุ๊ป จำกัด,,"วัฒนา, กรุงเทพมหานคร",4 วันที่ผ่านมา,
94,Quality Assurance Analyst,DST Systems,,กรุงเทพมหานคร,30+ วันที่ผ่านมา,
95,Senior Costing Analyst,Electrolux,3.8,ระยอง,14 วันที่ผ่านมา,
96,Technical Support / System Analyst,Lazada,3.8,Thailand,11 วันที่ผ่านมา,
97,Pricing Analyst,Whatsnew ( Orami ),,Thailand,30+ วันที่ผ่านมา,
98,Business Analyst,Lumentum Operations LLC,3.6,นิคมอุตสาหกรรมนวนคร,30+ วันที่ผ่านมา,
99,"Professional, Data Engineer",ธนาคารไทยพาณิชย์,4.5,กรุงเทพมหานคร,30+ วันที่ผ่านมา,
100,บริหารผลิตภัณฑ์การเงินและสนับสนุนธุรกิจ,ธนาคารเกียรตินาคิน,4.3,Thailand,30+ วันที่ผ่านมา,
101,System Analyst,TAKE IT SOLUTION,,"ห้วยขวาง, กรุงเทพมหานคร",29 วันที่ผ่านมา,
102,System Analyst,บริษัท เคพี ซอฟท์ จำกัด -บริษัท เคพี โซลูชั่น จำกั...,,"ห้วยขวาง, กรุงเทพมหานคร",วันนี้,"40,000 - 80,000 บาทต่อเดือน"
104,Business Analyst (IT),FRONTIS,,"บางคอแหลม, กรุงเทพมหานคร",21 วันที่ผ่านมา,
106,system analyst,บริษัท โอเชี่ยน สกาย เน็ตเวิร์ค จำกัด,,"บางนา, กรุงเทพมหานคร",30+ วันที่ผ่านมา,
108,นักวิเคราะห์ข้อมูล (Data Analyst),,,กรุงเทพมหานคร,30+ วันที่ผ่านมา,"25,000 - 35,000 บาทต่อเดือน"
109,Senior Financial Analyst,Pay Society Solutions,,กรุงเทพมหานคร,30+ วันที่ผ่านมา,
110,Big Data Analyst,เอซีอี เกมส์มิ่ง,,เชียงราย,30+ วันที่ผ่านมา,"15,001 - 18,000 บาทต่อสัปดาห์"
111,Trans Srvcs Analyst 1,CITI,3.9,กรุงเทพมหานคร,20 วันที่ผ่านมา,
112,Business Analyst ( Senior Level ),บริษัท ซัมมิท แคปปิตอล ลีสซิ่ง จำกัด,,"บางรัก, กรุงเทพมหานคร",30+ วันที่ผ่านมา,
113,Enabler- HRIS (Human Resource Information System),GC Maintenance and Engineering,,ระยอง,17 วันที่ผ่านมา,
114,PROCESS ENGINEER/ PROJECT ENGINEER,Global Green Chemicals,,กรุงเทพมหานคร,30+ วันที่ผ่านมา,
115,system analyst/นักวิเคราะห์ระบบ,บริษัท โสมาภา อินฟอร์เมชั่น เทคโนโลยี จำกัด (มหาชน...,,"มีนบุรี, กรุงเทพมหานคร",30+ วันที่ผ่านมา,"25,000 - 40,000 บาทต่อเดือน"
116,Senior System Analyst,Greenline Synergy,,กรุงเทพมหานคร,30+ วันที่ผ่านมา,
117,Business Analyst,บริษัท ธนาคารกรุงเทพ จำกัด (มหาชน),,"สาทร, กรุงเทพมหานคร",30+ วันที่ผ่านมา,
118,นักวิเคราะห์ระบบ (system analyst),บริษัท กลุ่มแอดวานซ์ รีเสิร์ช จำกัด,,"คลองสาน, กรุงเทพมหานคร",30+ วันที่ผ่านมา,"25,000 - 40,000 บาทต่อเดือน"
119,IT Analyst II,Maxim Integrated,,ชลบุรี,30+ วันที่ผ่านมา,
120,IT Senior Analyst,Seagate Technology,3.8,Thailand,30+ วันที่ผ่านมา,
121,Accountant I,Seagate Technology,3.8,Thailand,30+ วันที่ผ่านมา,
123,Business and Data Analyst,,,กรุงเทพมหานคร,30+ วันที่ผ่านมา,
126,Business Analyst,ธนาคารไทยพาณิชย์,4.5,กรุงเทพมหานคร,30+ วันที่ผ่านมา,
127,Business Analyst,Metro Systems Corporation PCL,,กรุงเทพมหานคร,30+ วันที่ผ่านมา,
128,งานทรัพยากรบุคคล,BJC,,กรุงเทพมหานคร,30+ วันที่ผ่านมา,
131,data classification specialist,บริษัท ชุน บ็อก จำกัด,,"บางกะปิ, กรุงเทพมหานคร",30+ วันที่ผ่านมา,
132,business analyst and quality control,"Online Asset Co.,Ltd.",,"ห้วยขวาง, กรุงเทพมหานคร",30+ วันที่ผ่านมา,"15,000 - 20,000 บาทต่อเดือน"
133,application analyst,"Advanced Systems Consulting Co., Ltd.",,"สาทร, กรุงเทพมหานคร",30+ วันที่ผ่านมา,
134,Supply Chain Data Analyst,,,กรุงเทพมหานคร,30+ วันที่ผ่านมา,
135,system analyst,กลุ่มบริษัท ซีดีจี,,"ยานนาวา, กรุงเทพมหานคร",30+ วันที่ผ่านมา,"30,000 - 60,000 บาทต่อเดือน"
136,mis analyst,บมจ.ธนาคารไทยเครดิต เพื่อรายย่อย,,"ดินแดง, กรุงเทพมหานคร",30+ วันที่ผ่านมา,
139,system analyst,บริษัท อะมอร์ ไอที คอนซัลท์ จำกัด,,"จตุจักร, กรุงเทพมหานคร",30+ วันที่ผ่านมา,"20,000 - 50,000 บาทต่อเดือน"
140,Business Analyst,บริษัทจัดหางาน ฮิวแมน เทค จำกัด,,"ลาดพร้าว, กรุงเทพมหานคร",30+ วันที่ผ่านมา,"60,000 - 80,000 บาทต่อเดือน"
141,system analyst/นักวิเคราะห์ระบบ (english language),บริษัท โสมาภา อินฟอร์เมชั่น เทคโนโลยี จำกัด (มหาชน...,,"คลองสามวา, กรุงเทพมหานคร",30+ วันที่ผ่านมา,"40,000 - 70,000 บาทต่อเดือน"
142,Data Analyst,The A-List International,,กรุงเทพมหานคร,30+ วันที่ผ่านมา,
143,system analyst,WINTEL SOFTECH RECRUITMENT,,"ราชเทวี, กรุงเทพมหานคร",30+ วันที่ผ่านมา,
144,system analyst **ด่วน!!!,"CDS Solution Corp.,Ltd.",,"จตุจักร, กรุงเทพมหานคร",30+ วันที่ผ่านมา,"25,000 - 50,000 บาทต่อเดือน"
145,System Analyst for Back Office in Technology,บริษัท ทุนภัทร,,กรุงเทพมหานคร,30+ วันที่ผ่านมา,
146,"Senior Analyst, Wholesale Banking Portfolio Analytics",ธนาคารไทยพาณิชย์,4.5,กรุงเทพมหานคร,30+ วันที่ผ่านมา,
147,IT Business Analyst,PTF,,Thailand,30+ วันที่ผ่านมา,
149,Investment Analyst,Adecco,3.8,กรุงเทพมหานคร,30+ วันที่ผ่านมา,
150,Data Analyst,The Siam Cement Public Company Limited,,กรุงเทพมหานคร,30+ วันที่ผ่านมา,
151,business analyst,บมจ.ธนาคารไทยเครดิต เพื่อรายย่อย,,"ดินแดง, กรุงเทพมหานคร",30+ วันที่ผ่านมา,
152,Logistics Analyst,Robert Walters,,กรุงเทพมหานคร,30+ วันที่ผ่านมา,
154,business analyst / programmer analyst,Apar Technologies (Thailand) Ltd.,,"วัฒนา, กรุงเทพมหานคร",30+ วันที่ผ่านมา,"30,000 - 60,000 บาทต่อเดือน"
155,Data Analyst Supervisor@คลังสินค้า Power buy (คลองส่งน้ำ บาง...,,,กรุงเทพมหานคร,30+ วันที่ผ่านมา,
156,senior system analyst,บริษัท ฟิกท์ แอสโซซิเอท จำกัด,,"พญาไท, กรุงเทพมหานคร",30+ วันที่ผ่านมา,"40,000 - 60,000 บาทต่อเดือน"
158,"Analyst, Consultant, Lean Consultant",Michael Page TH,,กรุงเทพมหานคร,3 วันที่ผ่านมา,
160,it datawarehouse and business analyst (สำนักงานใหญ่),บริษัท โออิชิ กรุ๊ป จำกัด (มหาชน),4.8,"ห้วยขวาง, กรุงเทพมหานคร",30+ วันที่ผ่านมา,"17,000 - 30,000 บาทต่อเดือน"
161,Head of Social Media and Content Strategy,Lazada,3.8,Thailand,6 วันที่ผ่านมา,
162,Junior Business Analyst,PRTR,,"ปทุมวัน, กรุงเทพมหานคร",30+ วันที่ผ่านมา,
163,system analyst / business analyst,Albatross Consulting,,"ห้วยขวาง, กรุงเทพมหานคร",30+ วันที่ผ่านมา,
164,System Analyst./ Business Analyst.,บริษัท อะมอร์ ไอที คอนซัลท์ จำกัด,,"จตุจักร, กรุงเทพมหานคร",30+ วันที่ผ่านมา,
166,SAP Technical Development (SAP Analyst/Jr. Consultant - Fres...,I AM Consulting,,กรุงเทพมหานคร,30+ วันที่ผ่านมา,
167,system analyst,บริษัท อินเตอร์ วิชั่น บิสซิเนสกรุ๊ป จำกัด,,"บางนา, กรุงเทพมหานคร",30+ วันที่ผ่านมา,
